{
  "id": "concept.le-canal",
  "slug": "le-canal",
  "title": "Le canal",
  "category": "tendance",
  "skillId": "skill.trend",
  "difficulty": "beginner",
  "definition": "Un canal relie des sommets et des creux par deux droites parallèles : le prix y oscille tant que les bornes tiennent.",
  "commonMistake": null,
  "sources": [
    "WMB — Les canaux"
  ],
  "status": "needsReview",
  "locale": "fr",
  "disclaimer": "Contenu éducatif. Aucun conseil en investissement, aucun signal, aucune promesse de gain.",
  "origin": {
    "sourcePath": "scripts/import-app/source/concepts.json",
    "sourceHash": "381bb579",
    "importedAt": "2026-07-18T10:44:52.521Z",
    "migrationVersion": 1
  }
}
