{
  "id": "concept.le-triangle",
  "slug": "le-triangle",
  "title": "Le triangle",
  "category": "figures",
  "skillId": "skill.patterns",
  "difficulty": "beginner",
  "definition": "Des bornes qui se resserrent traduisent une compression de la volatilité ; la sortie du triangle donne la direction potentielle.",
  "commonMistake": null,
  "sources": [
    "WMB — Figures : Triangle"
  ],
  "status": "needsReview",
  "locale": "fr",
  "disclaimer": "Contenu éducatif. Aucun conseil en investissement, aucun signal, aucune promesse de gain.",
  "origin": {
    "sourcePath": "scripts/import-app/source/concepts.json",
    "sourceHash": "87783d59",
    "importedAt": "2026-07-18T10:44:52.521Z",
    "migrationVersion": 1
  }
}
