{
  "id": "concept.le-double-creux",
  "slug": "le-double-creux",
  "title": "Le double creux",
  "category": "figures",
  "skillId": "skill.patterns",
  "difficulty": "beginner",
  "definition": "Deux creux à un niveau proche séparés par un rebond forment un « W », figure potentiellement haussière confirmée par la cassure de la ligne de cou.",
  "commonMistake": "Anticiper avant la cassure de la ligne de cou.",
  "sources": [
    "WMB — Figures : Double Creux"
  ],
  "status": "needsReview",
  "locale": "fr",
  "disclaimer": "Contenu éducatif. Aucun conseil en investissement, aucun signal, aucune promesse de gain.",
  "origin": {
    "sourcePath": "scripts/import-app/source/concepts.json",
    "sourceHash": "60b3db17",
    "importedAt": "2026-07-18T10:44:52.521Z",
    "migrationVersion": 1
  }
}
