{
  "id": "concept.le-stop-de-protection",
  "slug": "le-stop-de-protection",
  "title": "Le stop de protection",
  "category": "risk",
  "skillId": null,
  "difficulty": "beginner",
  "definition": "Un niveau décidé avant d’entrer, où le scénario est considéré comme invalidé : il borne la perte plutôt que de la subir.",
  "commonMistake": null,
  "sources": [
    "WMB — Méthode : Stop"
  ],
  "status": "needsReview",
  "locale": "fr",
  "disclaimer": "Contenu éducatif. Aucun conseil en investissement, aucun signal, aucune promesse de gain.",
  "origin": {
    "sourcePath": "scripts/import-app/source/concepts.json",
    "sourceHash": "0d6ca543",
    "importedAt": "2026-07-18T10:44:52.521Z",
    "migrationVersion": 1
  }
}
