{
  "id": "concept.le-double-sommet",
  "slug": "le-double-sommet",
  "title": "Le double sommet",
  "category": "figures",
  "skillId": "skill.patterns",
  "difficulty": "beginner",
  "definition": "Deux sommets proches séparés par un creux forment un « M », figure potentiellement baissière confirmée par la cassure du support intermédiaire.",
  "commonMistake": null,
  "sources": [
    "WMB — Figures : Double Sommet"
  ],
  "status": "needsReview",
  "locale": "fr",
  "disclaimer": "Contenu éducatif. Aucun conseil en investissement, aucun signal, aucune promesse de gain.",
  "origin": {
    "sourcePath": "scripts/import-app/source/concepts.json",
    "sourceHash": "63b528e8",
    "importedAt": "2026-07-18T10:44:52.521Z",
    "migrationVersion": 1
  }
}
