{
  "id": "concept.la-resistance",
  "slug": "la-resistance",
  "title": "La résistance",
  "category": "tendance",
  "skillId": "skill.trend",
  "difficulty": "beginner",
  "definition": "Une résistance est une zone plafond où les vendeurs reprennent la main. Une résistance cassée peut ensuite jouer le rôle de support.",
  "commonMistake": null,
  "sources": [
    "WMB — Support & Résistance"
  ],
  "status": "needsReview",
  "locale": "fr",
  "disclaimer": "Contenu éducatif. Aucun conseil en investissement, aucun signal, aucune promesse de gain.",
  "origin": {
    "sourcePath": "scripts/import-app/source/concepts.json",
    "sourceHash": "c1e7ff82",
    "importedAt": "2026-07-18T10:44:52.521Z",
    "migrationVersion": 1
  }
}
