{
  "id": "concept.la-tete-epaules",
  "slug": "la-tete-epaules",
  "title": "La tête-épaules",
  "category": "figures",
  "skillId": "skill.patterns",
  "difficulty": "beginner",
  "definition": "Trois sommets dont celui du milieu est le plus haut : un schéma de retournement dont l’invalidation se lit sur la ligne de cou.",
  "commonMistake": null,
  "sources": [
    "WMB — Figures : Tête-Épaules"
  ],
  "status": "needsReview",
  "locale": "fr",
  "disclaimer": "Contenu éducatif. Aucun conseil en investissement, aucun signal, aucune promesse de gain.",
  "origin": {
    "sourcePath": "scripts/import-app/source/concepts.json",
    "sourceHash": "5c2a0582",
    "importedAt": "2026-07-18T10:44:52.521Z",
    "migrationVersion": 1
  }
}
