{
  "id": "concept.les-biais-psychologiques",
  "slug": "les-biais-psychologiques",
  "title": "Les biais psychologiques",
  "category": "psychologie",
  "skillId": null,
  "difficulty": "beginner",
  "definition": "Ancrage, aversion à la perte, excès de confiance : des biais qui déforment le jugement. Les nommer aide à les tempérer par des règles écrites.",
  "commonMistake": "Croire qu’on y échappe par la seule volonté.",
  "sources": [
    "WMB — Psychologie : Biais"
  ],
  "status": "needsReview",
  "locale": "fr",
  "disclaimer": "Contenu éducatif. Aucun conseil en investissement, aucun signal, aucune promesse de gain.",
  "origin": {
    "sourcePath": "scripts/import-app/source/concepts.json",
    "sourceHash": "5e7686f4",
    "importedAt": "2026-07-18T10:44:52.521Z",
    "migrationVersion": 1
  }
}
